{
    "quizName": "AB-730: AI Business Professional - Set 1",
    "totalScore": 1000,
    "passingScore": 700,
    "questions": [{
            "id": 1,
            "topic": "Data Privacy & Training",
            "Question": "Which statement accurately describes how Microsoft 365 Copilot handles customer data in relation to Large Language Model (LLM) training?",
            "Options": [{
                    "id": 1,
                    "text": "Data is used to train global models only if the user gives explicit consent.",
                    "reason": "Incorrect. Microsoft does not use customer data for global training at all."
                }, {
                    "id": 2,
                    "text": "Data is anonymized and pooled with other tenants to improve the LLM.",
                    "reason": "Incorrect. Tenant isolation prevents pooling of any kind."
                }, {
                    "id": 3,
                    "text": "Data remains within the organization's tenant and is not used to train global models.",
                    "reason": "Correct. This is the cornerstone of Microsoft's AI privacy commitment."
                }, {
                    "id": 4,
                    "text": "Data is sent to OpenAI for processing and training on their public servers.",
                    "reason": "Incorrect. All processing happens within the Microsoft Azure/M365 boundary."
                }
            ],
            "MaxAnswerSelection": 1,
            "CorrectAnswers": [3],
            "CorrectAnswerExplanation": "Microsoft 365 Copilot honors the same data residency and privacy boundaries as existing M365 services."
        }, {
            "id": 2,
            "topic": "Excel Requirements",
            "Question": "A manager is unable to use Copilot in an Excel workbook stored on SharePoint. What is the most likely technical reason?",
            "Options": [{
                    "id": 1,
                    "text": "The workbook is saved in the .xlsb format.",
                    "reason": "Incorrect. While format matters, the most common issue is structural."
                }, {
                    "id": 2,
                    "text": "The data has not been formatted as an Excel Table.",
                    "reason": "Correct. Copilot requires the 'Table' object to identify headers and rows."
                }, {
                    "id": 3,
                    "text": "The workbook is currently being co-authored by another user.",
                    "reason": "Incorrect. Copilot supports co-authoring sessions."
                }, {
                    "id": 4,
                    "text": "The user does not have 'Owner' permissions on the file.",
                    "reason": "Incorrect. 'Edit' permissions are sufficient for Copilot use."
                }
            ],
            "MaxAnswerSelection": 1,
            "CorrectAnswers": [2],
            "CorrectAnswerExplanation": "Data must be converted to a Table (Ctrl+T) so Copilot can define the range for analysis."
        }, {
            "id": 3,
            "topic": "Prompt Engineering: Grounding",
            "Question": "In the Microsoft 365 Copilot architecture, what is the primary role of 'grounding'?",
            "Options": [{
                    "id": 1,
                    "text": "To filter out profanity and offensive language from the user input.",
                    "reason": "Incorrect. This is part of the safety guardrail system, not grounding."
                }, {
                    "id": 2,
                    "text": "To connect the LLM to specific, real-time business data via Microsoft Graph.",
                    "reason": "Correct. Grounding provides the context needed for accurate, tenant-specific answers."
                }, {
                    "id": 3,
                    "text": "To speed up the generation of text by using cached responses.",
                    "reason": "Incorrect. Grounding is about accuracy and relevance, not speed."
                }, {
                    "id": 4,
                    "text": "To ensure the AI only uses data that is more than two years old.",
                    "reason": "Incorrect. Grounding allows for up-to-date data retrieval."
                }
            ],
            "MaxAnswerSelection": 1,
            "CorrectAnswers": [2],
            "CorrectAnswerExplanation": "Grounding uses RAG (Retrieval-Augmented Generation) to supply the LLM with relevant business facts."
        }, {
            "id": 4,
            "topic": "The Four Pillars",
            "Question": "A prompt says: 'Review the attached ProjectCharter.pdf and summarize the key milestones in a table format.' Which part represents the 'Source' pillar?",
            "Options": [{
                    "id": 1,
                    "text": "'Review the attached ProjectCharter.pdf'",
                    "reason": "Correct. The document is the source material the AI must reference."
                }, {
                    "id": 2,
                    "text": "'Summarize the key milestones'",
                    "reason": "Incorrect. This is the Goal."
                }, {
                    "id": 3,
                    "text": "'In a table format'",
                    "reason": "Incorrect. This is the Expectation."
                }, {
                    "id": 4,
                    "text": "The professional tone of the request.",
                    "reason": "Incorrect. Tone is part of Context."
                }
            ],
            "MaxAnswerSelection": 1,
            "CorrectAnswers": [1],
            "CorrectAnswerExplanation": "The Source identifies the specific data (files, emails, chats) used to ground the response."
        }, {
            "id": 5,
            "topic": "Microsoft Loop",
            "Question": "How do Copilot components in Microsoft Loop facilitate team collaboration?",
            "Options": [{
                    "id": 1,
                    "text": "By locking the page so only one person can use the AI at a time.",
                    "reason": "Incorrect. Loop is designed for multi-user collaboration."
                }, {
                    "id": 2,
                    "text": "By allowing multiple users to iteratively draft and refine AI content on a shared canvas.",
                    "reason": "Correct. This is the core 'multiplayer' benefit of Loop."
                }, {
                    "id": 3,
                    "text": "By automatically deleting older drafts to save space.",
                    "reason": "Incorrect. Version history is maintained."
                }, {
                    "id": 4,
                    "text": "By converting all text into a static PDF once the AI finishes.",
                    "reason": "Incorrect. Loop pages remain interactive and live."
                }
            ],
            "MaxAnswerSelection": 1,
            "CorrectAnswers": [2],
            "CorrectAnswerExplanation": "Loop provides a collaborative 'Copilot Page' where teams co-create with AI."
        }, {
            "id": 6,
            "topic": "AI Phenomena",
            "Question": "What is the industry term for when an AI provides a factually incorrect response that appears highly convincing?",
            "Options": [{
                    "id": 1,
                    "text": "Model Drift",
                    "reason": "Incorrect. Drift refers to performance degradation over time."
                }, {
                    "id": 2,
                    "text": "Stochastic Parroting",
                    "reason": "Incorrect. This is a general critique of LLMs, not this specific error."
                }, {
                    "id": 3,
                    "text": "Hallucination",
                    "reason": "Correct. This is when the model predicts the next likely word based on patterns rather than facts."
                }, {
                    "id": 4,
                    "text": "Logic Bloat",
                    "reason": "Incorrect. This is not a standard industry term."
                }
            ],
            "MaxAnswerSelection": 1,
            "CorrectAnswers": [3],
            "CorrectAnswerExplanation": "Hallucinations are minimized by grounding but remain a risk inherent to LLMs."
        }, {
            "id": 7,
            "topic": "Copilot Studio",
            "Question": "You are building a custom Agent in Copilot Studio. What is the benefit of adding a 'Public Website' to the Knowledge tab?",
            "Options": [{
                    "id": 1,
                    "text": "It allows the Agent to use that website's information to answer user queries.",
                    "reason": "Correct. This provides a dynamic knowledge base for the agent."
                }, {
                    "id": 2,
                    "text": "It automatically hosts the Agent on that website.",
                    "reason": "Incorrect. The website is a source, not a deployment channel."
                }, {
                    "id": 3,
                    "text": "It allows the Agent to change the content of that website.",
                    "reason": "Incorrect. Knowledge sources are read-only for grounding purposes."
                }, {
                    "id": 4,
                    "text": "It bypasses the need for any user authentication.",
                    "reason": "Incorrect. Authentication depends on the deployment channel."
                }
            ],
            "MaxAnswerSelection": 1,
            "CorrectAnswers": [1],
            "CorrectAnswerExplanation": "Adding websites to Knowledge allows for 'Generative Answers' based on the site content."
        }, {
            "id": 8,
            "topic": "Teams Collaboration",
            "Question": "A company policy forbids the recording of meetings. How can employees still use Copilot to summarize a live discussion?",
            "Options": [{